{
  "schema_version": 1,
  "metadata": {
    "id": "liver-hepatic-lobule",
    "title": "Liver Histology: The Hepatic Lobule",
    "subject": "Histology & Pathology",
    "description": "Trace blood and bile through the classical hepatic lobule, then connect microscopic landmarks to their functional zones and characteristic patterns of injury.",
    "author": "Medical Sciences Faculty",
    "level": "Pre-clinical medicine",
    "estimated_minutes": 25
  },
  "viewer": {
    "dzi_url": "https://slides.example-med.org/liver-hepatic-lobule/liver-he.dzi",
    "label": "Liver, H&E whole-slide image",
    "coordinate_space": "image-pixels",
    "image_width": 80000,
    "image_height": 60000,
    "show_navigator": true,
    "max_zoom_pixel_ratio": 4
  },
  "sections": [
    {
      "id": "lobular-architecture",
      "title": "Orient to the classical lobule",
      "blocks": [
        {
          "type": "paragraph",
          "nodes": [
            { "type": "text", "text": "At low magnification, the classical hepatic lobule is organized around a " },
            { "type": "waypoint", "id": "central-vein-low", "text": "central vein", "x": 41400, "y": 28600, "zoom_level": 0.08 },
            { "type": "text", "text": ". Plates of hepatocytes and intervening sinusoids radiate toward it. The geometric boundary is subtle in human liver, so use vascular landmarks rather than expecting a sharply outlined hexagon." }
          ]
        },
        {
          "type": "paragraph",
          "nodes": [
            { "type": "text", "text": "At the lobular periphery, locate a " },
            { "type": "waypoint", "id": "portal-tract-low", "text": "portal tract", "x": 23800, "y": 17400, "zoom_level": 0.12 },
            { "type": "text", "text": ". Several portal tracts surround each central venous outflow region, creating the structural basis for gradients of oxygenation and substrate exposure." }
          ]
        }
      ]
    },
    {
      "id": "portal-triad",
      "title": "Resolve the portal triad",
      "blocks": [
        {
          "type": "paragraph",
          "nodes": [
            { "type": "text", "text": "Within the connective tissue of the portal tract, compare the thin-walled, relatively wide " },
            { "type": "waypoint", "id": "portal-venule", "text": "portal venule", "x": 24120, "y": 17620, "zoom_level": 0.65 },
            { "type": "text", "text": " with the smaller, rounder " },
            { "type": "waypoint", "id": "hepatic-arteriole", "text": "hepatic arteriole", "x": 24780, "y": 18140, "zoom_level": 0.95 },
            { "type": "text", "text": ". The arteriole has a conspicuous muscular wall relative to its lumen." }
          ]
        },
        {
          "type": "paragraph",
          "nodes": [
            { "type": "text", "text": "The " },
            { "type": "waypoint", "id": "bile-ductule", "text": "interlobular bile duct", "x": 25240, "y": 17350, "zoom_level": 1.2 },
            { "type": "text", "text": " is lined by cuboidal cholangiocytes. Unlike the adjacent vessels, it usually maintains a crisp epithelial boundary and contains no erythrocytes." }
          ]
        }
      ]
    },
    {
      "id": "sinusoidal-compartment",
      "title": "Follow blood through the sinusoid",
      "blocks": [
        {
          "type": "paragraph",
          "nodes": [
            { "type": "text", "text": "Portal venous and hepatic arterial blood mix in the " },
            { "type": "waypoint", "id": "hepatic-sinusoid", "text": "hepatic sinusoids", "x": 35600, "y": 24800, "zoom_level": 1.0 },
            { "type": "text", "text": " and flows centripetally toward the central vein. Fenestrated sinusoidal endothelial cells permit exchange with the perisinusoidal space of Disse." }
          ]
        },
        {
          "type": "paragraph",
          "nodes": [
            { "type": "text", "text": "A " },
            { "type": "waypoint", "id": "kupffer-cell", "text": "Kupffer cell", "x": 36120, "y": 24530, "zoom_level": 1.75 },
            { "type": "text", "text": " lies along the luminal face of the sinusoid and participates in phagocytosis. Do not confuse its elongated or irregular nucleus with the flatter nucleus of a sinusoidal endothelial cell." }
          ]
        }
      ]
    },
    {
      "id": "flow-and-zonation",
      "title": "Integrate opposing flows and metabolic zones",
      "blocks": [
        {
          "type": "paragraph",
          "nodes": [
            { "type": "strong", "text": "Blood flows portal tract → central vein; bile flows in the opposite direction. " },
            { "type": "text", "text": "Canaliculi between adjacent hepatocytes conduct bile toward canals of Hering and portal bile ductules." }
          ]
        },
        {
          "type": "paragraph",
          "nodes": [
            { "type": "text", "text": "The periportal region, " },
            { "type": "waypoint", "id": "zone-one", "text": "acinus zone 1", "x": 27000, "y": 19400, "zoom_level": 0.28 },
            { "type": "text", "text": ", receives oxygenated blood first. The centrilobular region, " },
            { "type": "waypoint", "id": "zone-three", "text": "acinus zone 3", "x": 40500, "y": 28000, "zoom_level": 0.28 },
            { "type": "text", "text": ", is relatively hypoxic and has high CYP450 activity. This helps explain why ischemia and several toxic injuries preferentially affect zone 3." }
          ]
        }
      ]
    }
  ],
  "overlays": [
    {
      "id": "vascular-landmarks",
      "label": "Vascular landmarks",
      "color": "#0EA5E9",
      "visible_by_default": true,
      "shapes": [
        { "type": "rectangle", "label": "Central vein", "x": 39600, "y": 26900, "width": 3600, "height": 3400 },
        { "type": "rectangle", "label": "Portal tract", "x": 22400, "y": 15900, "width": 4700, "height": 4500 }
      ]
    },
    {
      "id": "metabolic-zones",
      "label": "Acinar zones",
      "color": "#F97316",
      "visible_by_default": false,
      "shapes": [
        {
          "type": "polygon",
          "label": "Periportal zone 1",
          "points": [
            { "x": 24400, "y": 16600 },
            { "x": 31800, "y": 19900 },
            { "x": 29200, "y": 24700 },
            { "x": 22500, "y": 20500 }
          ]
        },
        {
          "type": "polygon",
          "label": "Centrilobular zone 3",
          "points": [
            { "x": 35900, "y": 24200 },
            { "x": 44700, "y": 24500 },
            { "x": 45500, "y": 32600 },
            { "x": 36500, "y": 33000 }
          ]
        }
      ]
    }
  ]
}
